urlDrugName,highly_effective,benefitsReview
ortho-tri-cyclen,Effective,"I felt great. Highly effective at preventing pregnancy. My skin looked decent while on the pill as well. I had a doctor tell me once that this pill was one the best birth controls to use. I agree, seeing as I am the patient. Its always nice to know when to expect your period :)"
fosamax-plus-d,Effective,"Between 1998 and 2006, when I was going through menopause, my bone density went from normal to borderline osteoporosis, as shown by the results of two bone density tests given on those dates. After I received my bone density results in 2006, my physician put me on Fosamax, which I have taken regularly for the past two years.  When I took a bone density test recently in 2008, my bone mineral density had increased by almost 6% over a two-year period. I remain in the range of osteopenia, but am midway now between normal and osteoporosis in my T-scores."
effexor,Effective,"Signifigantly reduced depression, social anxiety. Mild side effects."
cymbalta,Not Effective,"The benifit of taking the drug was to decrease the symptoms of depression and anxiety. In addition, the drug did not suppress the libido on the opposite it increase the sexual desire."
noroxin,Effective,"The bacterial infection in the prostate was quickly controlled, immediately ."
meridia,Effective,"I lost 90 pounds in 6 months. The key was drinking water all throughout the day. I ate 1 meal a day before 6pm & snacked on fruit (applesauce, fruit cups, canned fruit,etc.)  all through the day (instead of fast food, icecream, chips or any other food that is unhealthy). I saw no results in the first month, but once 30 days had passed, I started to lose 1 lb. a day & sometimes 1 1'2 lb. a day. Even after getting off of Meridia, I still continued to lose weight 2 months later. Product was VERY expensive but worth it! The more weight you have to lose the more you WILL lose!"
prozac,Effective,Reduced depression and feelings of hopelessness within 3 weeks. I like being able to increase dosage when things get a little rough and then back off to the original dosage when things settle down.
hytrin,Effective,Tried many different drugs all either failed to reduce my blood presure or had side effects which I did not want to live with. Hytrin has brought my blood pressure under control with absolutely no side effects
asacol,Not Effective,Flare-ups were less frequent as well and the duration of time they lasted was less. I noticed that it didn't help with the amount of bowl movements I was having but it did help stop the internal bleeding.
alendronate,Not Effective,"Very limited for the amount taken.  New bone density showed slight improvement, ie 2 years ago spine was -3.3, now is -2.9."
synthroid,Not Effective,"The synthetic thyroid hormone treatment made it so I was at least able to function, sped my metabolism up enough to keep warm and have regular menses."
lamotrigine,Effective,"My miracle drug!! I have suffered for years with extreme mood swings, depression, and bulimia. It was several months ago that I was diagnosed with bipolar 2-I was immediately prescribed Lamictal-I didn't really notice a difference so my dr. upped it to 150mg. It has worked wonders! I am so proud to say that I am happy and I haven't felt this elation in years! I can actually stay awake during the day, I have the drive to exercise, my labido is back(sure did miss that), almost no mood swings at all and most importantly I feel like a mother again! I have 3 beautiful little girls that I can hug, kiss, and love again!! I feel like crying-in a good way-everytime I think about how happy I am! My only fear is wondering how long this will last-I can only pray this will last forever."
premarin,Effective,"After my hysterectomy, I was depressed, didn't want to have company, was suspicious of everyone and everything. I wasn't feeling like my former self at all.  Once I began the hormone replacement therapy (Premarin), I began to feel much better immediately.  The depression left and I felt younger and much more able to cope with daily life.  I take Premarin (.625mg) daily."
flonase,Effective,Treatment began to work after 3 days. I had not been able to smell for 10 years and my smell is now restored.
botox,Effective,the treatment (eyes & forehead) was highly effective and lasted 6 months each of the 3 times I was treated. I have a very deep vertical line between my eyes which was all but invisible with each treatment. I loved it!
prinivil,Not Effective,The only positive effects was blood pressure moderately controlled.
botox,Effective,"I used to have near-daily migraines.  I tried every migraine medication on the market.  Either they didn't have any effect, or I was unable to tolerate them due to side-effects.  With Botox injections administered by a very knowledgable neurologist who is also a pain specialist, I am virtually migraine-free for months."
albuterol,Effective,Opened lungs when breathing was difficult.
enbrel,Effective,"My worst symptom was in my feet. It was painful to walk, and therefore I walked slowly even when I used shoes with good support (Birkenstocks), especially going down stairs. There was some pain or discomfort in my lower back. These were my symptoms when I was on methotrexate alone. When I started Enbrel, I felt the effects within hours. Within the same day I could walk decently with much less pain. Within the next few days and weeks, I'm practically back to normal. In my second month, I think I started to feel a tapering off of its effects, which doctors warned me about and I read about: I felt a faint shadow of the foot pains I used to experience but I can still move normally."
neurontin,Effective,"The Lidoderm numbs my back for most of the day so that the pain is dulled dramatically.  The Neurontin eventually blocked my pain so well I was able to get out of bed after being stuck in it for 4 1/2 months.  These two pain relievers work so very well together.  There is nothing that is going to take all of the pain away.  I am also on other medication for this as well. Being able to walk around again finally, was like, what took you so long to figure it out what to do?  I'm not broken, I'm hurt.  I have children at home, I need to at least be mobile!"
sarafem,Effective,"I have taken this drug off and on for the past 13 years. I have always had good results with it, but I wanted to go off it to have children. Then, after my last child, I tried to make it without medication, but I realized I couldn't. I am very careful about the medications I take and I don't like being stuck on anything. However, I realized that I needed help and my children needed a happy Mommy. I went back on Prozac (the generic form) 2 months ago and now feel better than I have in years. I can cope with the daily stresses of life without losing my temper, or my mind. I can face the responsibilities of each day without fear, hopelessness, or doubt. I can laugh and enjoy my children. I am truly a new person. I am regretting not going back on this medication sooner."
levoxyl,Not Effective,"I am not sure if it was levothyroxine that helped to normalise the hormone levels. It's kind of strange, as they've only were back in range, when i stopped taking l-thyroxine."
dilaudid,Effective,the drug treatments stopped the headaches.
flexeril,Effective,Had a lot of headaches all day every day. Doctor said it was tension headaches made by a muscle spasm in my neck. She prescribe this medicine and the headaches are hardly there.
seroquel,Effective,Was able to sleep for seven hours at night without waking up.
xanax,Effective,Was able to get to sleep and stay asleep for a full eight hours.  Could go to sleep within an hour of taking the drug and was able to still wake up the next day. I take one benadryl with the xanax to help get the sleep cycle started.
klonopin,Not Effective,none
sarafem,Effective,"This drug improved my mood greatly. I can take more stress at work, in my romantic life, and family situations where as before, I would crawl under a rock and cry. A lot of people say that they don't feel much on this drug, but I think it was low enough to where I could have moderate lows and elevated highs. It helped me control my impulsive behavior with eating."
effexor,Effective,This drug turned my severe recurrent depression around.
malarone,Effective,I didn't get malaria
tobramycin,Effective,revieved my eyes of the redness and puffiness and fluid that had been coming out of my eyes.
tetracycline,Not Effective,This did help clear acne infections and helped skin somewhat improve
claritin,Not Effective,"reduction in allergy symptons-  less nasal congestion, and itchiness in eyes was reduced--"
tramadol,Not Effective,Lessened the pain associated with the inflamation
minocycline,Effective,My skin cleared considerably in about two weeks after starting this medication and has remained relatively clear over the 10 months i have been taking it.  I have far fewer hormonal breakouts around my chin and my skin seems generally less congested with fewer blackheads.  I have also noticed a reducation in oil on the surface of my skin.
remicade,Effective,STOPPED THE SYMPTOMS OF ULCERATVE COLITIS W/I 2 WEEKS
retin-a,Not Effective,skin cell turnover increases
yasmin,Effective,"Treatment benefits included prevention of pregnancy, clearer, more manageable skin, reduced menses and significantly reduced cramps. I never had another huge cystic acne after taking this medication. I had very VERY tiny acne occasionally. I mainly went to the doctor for heavy cramps. Now each month I do not suffer from cramps and am very happy."
accutane,Effective,"Although it's a very powerful/dangerous drug if used while pregnant, or not monitored by your doctor, Accutane really helped my skin. I have tried EVERYTHING! THe benefits were it got rid of all my acne, it shrunk my pores, made my skin less oily, and my hair, smoother skin, brighter skin, even toned. On Accutane i didn't have to wash my hair for 3-4 days. Normally I had to wash my hair everyday because it was so greasy. I would never go without a day of washing when I wasn't on Accutane."
seroquel,Not Effective,"I feel more level, able to think and concentrate, less stressed and not bothered about anything."
zithromax,Effective,Decreased sputum production and increased lung function.
elavil,Effective,have gone without a headache or migraine for 3 weeks now.  I have very mild neck pain.
nasonex,Effective,"I was finally able to breathe, no dry feeling, no post nasal drip, I sing and it helped me tremendously"
yasmin,Effective,"Prevented pregnancy, i did not experience any benifits whatsoever"
coumadin,Effective,The clots eventually completely dissolved over the course of the treatment.
lamisil,Not Effective,"I did not see a change in the condition of the toenail. Only about a quarter if the left great toenail was affected. After taking the drug for the 12 weeks, the physician recommended another 12 week course, however my insurance company would not cover the extended treatment and I could not afford the cost of Lamisil. Perhaps a positive effect would have been realized if I was able to continue the treatment"
vagifem,Effective,Using Vagifem for the first 18 months was brilliant. It increased lubrication and stopped the continual urethral soreness I had (and when passing water). It made everything feel normal again.
biaxin,Not Effective,There weren't any.  I had to stop taking this medicine after 4 days due to the side effects.
ortho-tri-cyclen-lo,Effective,"the medicine was for contraceptive purposes, which it achieved. The medicine also regulated the periods and made them on a more regular basis. It also cleared my skin and helped with acne."
voltaren,Effective,substantial reduction in joint pain caused from arthritis.
accutane,Effective,The drug cleared my skin and even reduced some of the redness and scarring from the acne.  This was my first and last treatment.
minocycline,Not Effective,"I think that the treatment might have improved my acne somewhat, but it always returned.  I stayed on this drug for several years, along with using topical medications.  I was using so many prescriptions that I don't really know which if any of them helped.  I always still had some acne during this treatment."
hydrochlorothiazide,Not Effective,Helped with decreasing intermittent fluid retention in ankles and worked in conjunction with BP medication to decrease BP
actonel,Not Effective,The loss of bone mass retarded. It is difficult to measure the efficacy of the drug apart from a bone scan.  I do not nor have ever broken a bone. Considering my weakness in my wrists this drug may be credited with bone integrity.
wellbutrin-xl,Effective,Remarkable improvement in productivity (no down time) and feeling of well-being.
armour-thyroid,Not Effective,"increased energy (moderate), weight stabilized"
depo-provera,Effective,"No pregnancy,no periods for 18 years, no menopause, estrogen production stopped, convenience"
sotret,Effective,Cleared up my acne - worked very well. Skin was softer.
elocon,Effective,simptoms disappeared promptly.
flexeril,Not Effective,the benefits aren't that great but i do get some kind of relief. i am in pain everyday all day.
diclofenac,Effective,"I have mild arthritis in my knees.  I play tennis 3-4 times a week and consistently experienced mild pain and swelling.  I just did not want to give up tennis so I played through the pain.  Within a week after taking Diclofenac, my knees felt like they did when I was 18!!!  It really was amazing and continues.  I litlerally have NO PAIN whatsoever in my knees..."
ambien,Effective,"The Ambien did give me a solid nights rest. I did not experience the rapid effect that I've often read about, i.e. that I would fall asleep within 20 minutes even if I was in the middle of an activity. It usually took about 40 minutes to take effect."
chantix,Effective,I quit smoking!!!! And so did my husband who was also taking it. I smoked about 1 pack a day and he smoked about 2 packs a day. Our lives have changed because of this drug and our children will be healthier too!
synthroid,Effective,"Prior to taking this medication, I was feeling very tired and ""fuzzy headed"".  I thought these feelings were just due to being overly busy and getting older.  In an annual check-up it was discovered that my thyroid levels were off.  This medication brought my thyroid level to normal. I noticed increased energy and mental clarity within just a few days of starting the medication."
diclofenac,Not Effective,"Seemed to reduce some every-day pain and inflamation, although I still experienced increased pain and inflamation after physical therapy or increased activity."
accutane,Effective,"I had cystic acne, however within the first month i the acne reduced significantly! By the time i was at the 6 month point i had no acne at all. The only down side were the side effects... i felt joint pain, extreme dryness- esp my lips, very dry eyes. I was uncomfortable, however i have been 1 1/2 year without it and i barely get a little zit anymore."
differin,Not Effective,I had acne constantly and would break out a few time a week.  My breakouts have gotten better and only occur occaisionally.
ultram,Effective,"My pain would subside for several hours. The drug gave me a sense of Euphora which allowed me to deal with the pain better. It gave me a comforting sensation and allowed me to sleep good. My mood changed for the better, almost as if I were high.It actually motivated me to do the things i would normally be too lazy to do. This medication put me in a good mood and a carefree mood."
soma,Not Effective,The Soma made the patient agitated and did not work. The Flexril made the patient relax and sleep enough to let the rib heal nicely.
doxycycline,Effective,It helped cure the acne all over the bodyhhhhhhhhhh
effexor,Not Effective,There were absolutely NO treatment benefits. I felt worse while on this drug than before I started taking it.
keflex,Not Effective,"Mild suppression of the infection, slightly reduced upper respitory tract symptoms, some reduced coughing, some reduced mucus production. The symptoms took at least 5 out of the seven days to begin to dissipate, which is very slow compared to another antibiotic such as Maxamox. Unfortunately the side effects were more noticeable than the treatment benefits, and the prescribing doctor mistook the side effects for another symptom that was not actually present."
zocor,Not Effective,Did not take it long enough to evaluate the benefits.
singulair,Effective,lower blood pressure
prozac,Effective,Anxiety since childhood was relieved.  Felt free to enjoy life and explore opportunities that once would have been declined due to over anxiety and fear of failure or rejection. Have a much more stable emotional balance.
differin,Not Effective,"my acne calmed down by 75%.still had some break outs when not used on time,but still nothing else would stop the break outs.everything I used just made it worse and mt skin was very dry and inflamed.those problems went away.my skin isn't dry it is back to normal even in the winter when its dry out."
aromasin,Effective,"During the 4 years so far [out of 5], I have had no recurrance of the tumour and no additional tumours have been detected by ultra-sound, mammogram, and twice-yearly check-ups. Perhaps the greatest benefit is the gradual reduction in stress experienced as a result of my on-going stabilised condition after a lumpectomy."
premarin,Not Effective,stopped hot flashes
accutane,Effective,cleared up acne with first treatment.
topamax,Not Effective,"going from at least 5 full days of migraine a week i managed 16 whole days without one. then when i did have one it was for 6 straight days and the migraines have been back to as they were before. brief relief was seriously chuffed, now gutted, maybe dosage increase may help???"
vyvanse,Effective,"Alleviation of depression nonresponsive to several SSRIs,SNRIs,atypical antipsychotics.  Decreased ruminating/continuous negative thinking, decreased pain and/or focus on pain, decreased need for pain meds. Increased confidenceand social functioning, increased ability w/ADLs, increased energy, increased focus and ability to concentrate, increased memory and word retrieval"
lortab,Not Effective,Helped some what to control the pain from a disk setting on my siatic nerve. It did not stop the pain but it did help lesson the amount of pain so I could function better.
acyclovir,Effective,"I was 6 days into having my very first cold sore which had since turned into TWO on the left and right sides of my bottom lip and I had already tried abreva and campho-phenique with absolutely no benefit. I thought I was going to suffer for weeks. It was so painful and kept scabbing then the scabs would fall off after drinking or taking a shower. Then I saw my dr who prescribed Zovirax ointment. I swear, the NEXT day, both cold sores were half the size and no longer ""weeping"". It is just about healed. This stuff works and now that I know I get cold sores, I will never be without Zovirax. Ever."
metformin,Effective,The Medformin controls my blood sugar. I've been taking it for eight years now with no side effects. I continue to enjoy the food I eat without worry because I regularly take this medicine. It does not contradict with the medicine I take for my hyperthyroidism. Medformin is also affordable that's why I can regularly take this medicine.
augmentin,Effective,"The medicine was taken to prevent infection since a hole was drilled to drain the gathered blood and release pressure on my nail bed.  As a result, I am in the process of regrowing a healthy nail."
metrogel,Not Effective,Reduced redness of the forhead and cheeks.
tri-luma,Not Effective,"The first time I used the drug it lightened the patches of melasma. The second time I used it, about a year later, it actually darkened them. I was told that happens to some people who use hydroquinone and that I will never be able to use it. I use sun block every day, year round.

I am Irish-Italian-German-Dutch. My skin is fair yet any trauma results in hyperpigmentation."
estrasorb,Effective,"completely changed my way of life...  within days, could tell a difference... no longer suffer from night sweats or hot flashes at all,  the best thing i have ever tried..  this is a topical lotion that comes in individual packets that are 1.74 grams each (daily dosage is  2 packets)"
clonazepam,Effective,"Reduced anxiety, calmness. Prior to using this drug I was not able to function well in my job. I did not want to go out, particularly to crowded areas such as church or shopping. Now I have no problem with going out."
zyban,Effective,it has done its job and i am smoke free now for 10 weeks
ortho-tri-cyclen,Effective,"Ortho Tri Cyclen effectively prevented pregnancy, cleared up acne, gave me regular periods, helped with iron deficiency due to blood loss"
wellbutrin-sr,Effective,rid patient of emotional highs and lows.  Bring them to an even mamgeable level.  Also eased if not completely diminished all of patients anxiety related syptoms and eased those of the ocd to a more manageable level as well.
actonel,Not Effective,none: loss of bone density
nuvaring,Effective,"had a more regular period, knew that i would be getting my period 2 days after i took the ring out. could leave the ring in longer if i wanted to and delay my period. did not feel it at all during any activity. never fell out."
chantix,Effective,ALLOWED ME TO QUIT SMOKING WITHOUT THE PHYSICAL WITHDRAWL
metronidazole,Not Effective,"I took my puppy to the vet. The puppy was having diarrhea and vomiting. The vet gave him metoclopramide (perinorm) for vomiting and Metronidazole for diarrhea. 
Within 2 days the puppy died. He was so weak after metronidazole that he could not move . He was quiet ok before I took him to vet."
citalopram,Effective,"I suffered from anxiety for years. My GP prescribed me the Citalopram after I got unfairly dismissed from my job. I didn't feel any difference for 2-3 weeks, then I felt great. I have been enjoying every second of my life since taking this drug."
propecia,Effective,"After a couple weeks, my hair grew stronger, hairs that were lost along the hairline grew back.  This product really does work"
botox,Effective,the frown lines on the forehead were diminished for a period of abut 3 months
zyrtec-d,Effective,"Zyrtec D helped me live almost symptom free every day. Only during the fall when the ragweed count was exceptionally high (my worst allergy by far), did I feel some mild symptoms of allergies. No other medication has so effectively eliminated my symptoms on a consistent basis."
lunesta,Effective,Was able to fall asleep within 30 minutes of taking Lunesta.  Stayed asleep for at least 4 hours to 10 hours.
symbicort,Not Effective,Moderately helped control my asthma and COPD.
qvar,Effective,"The treatment benefits of QVAR are that I do not think about my condition. Also, it is easy to execute the treatment.  I exercise and go about my day as if I were not afflicted with asthma.  I do not worry about having an attack, which is a big relief.  The treatment is inconspicuous, another plus."
climara,Effective,"Immediate relief of hot flashes (from 10-12 per day to 2-4 per week),sleep disruption, moodiness/agitation, depression (or periodic unexplained ""dark days""), lack of libido."
tri-luma,Not Effective,I've not got any benefits. I've just spoiled my skin and pigment spots look now dark brown and they are very obvious.
adipex-p,Effective,Extremely effective appetite suppresant. Provides long-term energy and appetitie control throughout the day. Helps patient easily lose weight.
imitrex,Effective,I am so thankful for Imetrex. I have severe migraine headaches at leat 2 to 3 times a month. Before taking Imetrex my headaches would last 3 to 4 days. With Imetrex I can take the pill and my headache is gone within the hour. I have no side effects from the taking this medicine.
adderall,Effective,I was able to focus and get things done.  I wasn't overwhelmed with the amount of things I had to do and didn't get discouraged as easily as usual.
lipitor,Not Effective,none tho my doctor told me that it would lower my cholesterol if I took it and ate less red meat and more fish. But I don't like fish and love red meat so just eat low fat meat now like chicken.
nolvadex,Effective,prevention of recurrence of estrogen positive tumours
levora,Effective,protection against pregnancy.
plendil,Not Effective,"blood pressure came to with in normal limits, overall feeling of well-being and reduced risk of longterm cardiovascular copmlications"
ultram,Not Effective,"the medicine in the beginning provided about 30% relief in pain, but as time progressed it only provided about 10% pain relief. This being said, it does provide some mental relief from chronic pain. and it relieves some of the muscle stiffness."
naprosyn,Not Effective,"pain relief from arthritis flare up, no stomach or other side effects.
The medication needed to be taken with food or milk to avoid stomach upset."
tazorac,Effective,"I had gotten severe age spots on my hands, probably from spending many years driving long distances each day.  My hands looked worse than anyone else's my age (or older!).  My hands now looks pretty good/very good!"
cymbalta,Not Effective,none
halcion,Not Effective,Benefits were to treat insomnia.
effexor-xr,Not Effective,some decreased depression but not as well as with wellbutrin
sumatriptan,Effective,The drug rapidly gets rid of migraine.
