urlDrugName,highly_effective,benefitsReview
enalapril,Effective,"slowed the progression of left ventricular dysfunction into overt heart failure 
alone or with other agents in the managment of hypertension 
mangagement of congestive heart failur"
ortho-tri-cyclen,Effective,"Although this type of birth control has more cons than pros, it did help with my cramps. It's also effective with the prevention of pregnancy. (Along with use of condoms as well)"
ponstel,Effective,"I was used to having cramps so badly that they would leave me balled up in bed for at least 2 days.  The Ponstel doesn't take the pain away completely, but takes the edge off so much that normal activities were possible. Definitely a miracle medication!!"
prilosec,Not Effective,"The acid reflux went away for a few months after just a few days of being on the drug. The heartburn started again as soon as I stopped taking it. So I began treatment again. 6 months passed and I stopped taking it. The heartburn came back, and seemed worse even. The doctor said I should try another 6 month treatment. I did, and the same exact thing happened. This went on for about three years. I asked why this wasn't curing my reflux. The doctor quite frankly told me that it wasn't a cure, but a ""treatment for the symptoms"". I was told that I would probably be on it for the rest of my life."
lyrica,Not Effective,"I think that the Lyrica was starting to help with the pain, but the side-effects were just too severe to continue."
propecia,Not Effective,"after taking propecia for over a year, starting when i was 20 years of age my hair continued to thin, and i noticed no significant benefits"
vyvanse,Effective,"My mood has noticably improved, I have more energy, experience better sleep and digestion."
xanax,Effective,"This simply just works fast and without any of the nasty side effects of SSRI medicines. I won't go into a long story of my panic attacks which I sought help for many years after the fact. This just works and it does what it's supposed to without any annoying side effects. When taken daily, it has stopped my panic attacks from starting and thinking patterns that lead to them. I find it can also be used as needed along with the daily treatment."
claritin,Not Effective,"none - did nothing to help allergies. i just had a dryer, more painful version of my allergies with new allergies/irritations developing on top of my original ones. this stuff is dangerous and the side effects that many people are experiencing are not listed on the package. a class action lawsuit needs to happen."
dextroamphetamine,Effective,"Smoother more gradual onset and effect than Adderall. Effective at controlling ADD symptoms previously controlled by Adderall however this drug seems more natural and transparent. Less tension and anxiety. Less ""druggy"" unnatural feelings and thoughts."
effexor-xr,Effective,"reduction in anxiety, no panic attacks.  drug is extremely effective"
neurontin,Not Effective,"I'm taking Gabapentin to treat nerve disorder. My nerves are inflamed and causes to experience pelvic pain and other pelvic disorders. The Gabapentin sometimes works but I do experience relapse.

For the migraines
I find that the 800mg of Ibprofen works better with no side effect for my migraines, but the maxalt has a better track record."
omnicef,Not Effective,don't know yet back to pediatrician today
dovonex,Not Effective,"Controlled the psoriasis, however did not reduce its presence."
protopic,Effective,cure the ezcema and it took aout teh roughest of the skin
sotret,Effective,"I took isotretinoin for persistent adult acne.  My skin was not by any means awful, but I did have evident pimples on my forehead and chin, and awful, awful blackheads on my nose that despite daily steaming and extraction, were terrible.  The drug totally cleared up my face, and my blackhead literally dried up in front of my eyes.  My once horribly oily skin changed to almost normal."
retin-a-micro,Not Effective,"The treatment benefits included Skin Regeneration, and decreased Acne.  My skin felt more smooth and the pigmentation was disapearing.  Overall, the goals were accomplished however the redness of the skin took over."
symbicort,Effective,"I had taken Pulmicort, and other inhalants, with no major changes.  It became more difficult to maintain my exercise and lively life style. I gave in and began Symbicort and immediately experienced a relief of shortness of breath, weezing.  I feel like a new person. I still have a reaction to cold wind, and very high humidity, but so much better.  I rarely use my Albuterol."
lyrica,Not Effective,"It seemed to work at first, but then the side effects started. Fatigue, severe memory loss, poor decisions, urinary incontinence, personality changes (crabby, irritable, withdrawn). The hard part is I can't seem to get off this stuff!! The withdrawals are horrible, shakiness, feelings of doom, loss of appetite, nausea, palpitations. It scares me so much that I just start taking it again. I'm stuck!! Don't ever start this stuff, there is something wrong with it. I don't know if I will ever be myself again."
actonel,Not Effective,My  bone density's results have always been stable and I was told to continue with the drug.
provigil,Not Effective,"I was more alert during the first part of the day but I found that it wore off by the afternoon. I could focus clearly, and if I needed a boost during the day another dose was enough."
wellbutrin,Effective,"I have taken antidepressants for many years, and this is first that did not ""flip the switch"" on sexuality.  I no longer feel like I am looking out of a dark room.  I have more energy, feel more motivated, and overall function at a higher level than before."
propecia,Not Effective,"Ostensibly this will halt or even reverse the effects of male-pattern baldness. So far, one month in, there is not a great deal to report. I expected my hair loss to temporarily increase, as I had read in the literature that as dormant hair follicles reactivate, they push dead hairs out in order to form new ones. In other word, hair in a dead follicle will linger for a few months, and reactivation of the follicle will push out the old hair to make room for the new. So far, this has not occurred. The product must be taken for up to two years for any noticeable hair growth to take place, so I really haven't been on it long enough to judge its re-growth potential. In terms of halting the process, however, I must say there are fewer hairs in my brush each morning, so it's possible the drug is having an effect already. I will post a fuller report in another forty-seven months, I suppose."
nortriptyline,Not Effective,I have A-typical migraines which gives me weird sensation in my ears such as roaring and the sense that they are vibrating.  I also do have headacheds that seem to come from ears and the back of my neck.  It help me feel better and started to decrease my symptoms but side effects were worse than original symptoms.  It helped me to ignore my symptoms and helped me to get through the day.
imitrex,Effective,migraine headache would stop
doxycycline,Effective,"I had   persistent periodontal problems, both stressful and painful.  Every dentist I saw  told me I was going to lose my teeth.  This drug  cleared up the condition.  It protected me against inflammation for the entire period of time that I took it.  I continued taking the drug much longer than is usually recommended because it was so effective. The effectiveness did not seem to diminish."
topamax,Effective,"To stop with the migraines, seizures and pain from the fibromyalgia,also have neuropathy in hands and feet from diabetes"
levitra,Effective,The stuff works like a charm--fast and effective.
lamictal,Effective,Effective at controlling seizures without dizziness
accutane,Effective,"Eventually Cleared my moderate acne. Had recieved antibiotics etc previosly which reduced it from severe to moderate, but then accutane completely cleared my skin after 5 months"
zocor,Effective,"Brought down my overall cholestorol reading from 218 to 150, LDL from 135 to 90 and triglycerides from 180 to 140 within 3 months time."
ortho-tri-cyclen,Effective,"No undesired pregnancies, lighter period"
minocycline,Not Effective,"I took Minocycline hoping that it would clear up my acne. I have been taking Tetracycline for over 2 years without no result, frustrated, my doctor prescribed Minocyline. After 1 year, I was still having break out just not as bad."
estrace,Effective,"no menopose benifits are loss off sytoms of menopose. improved mood leval. I have felt more energectic aand as stated a general mood elevation. I have started working out , less irratable and overall calmer. The hormone replacement has improved my lifestyle and relationships to others. I am know longer quick tempered or irritable."
meridia,Effective,Lost over 30 pounds and still going!
sotret,Effective,"acne cleared totally,skin became even."
prevacid,Effective,After 2 days of taking the medication my stomach pain subsided.  The burning i also began to go away.  it took a full week for everything to return to normal for mw.
renova,Not Effective,"Skin in certain areas (e.g. forehead, cheeks) sun damage became less noticeable. Fine lines have slightly improved. However fine lines on the lower eyelids have become worse. It was therefore, not used on fine lines on the lower eyelids the entire 1 year. I have used it approximately 4 months out of the 1 year in this area. It made it crease up and look wrinkled"
depakote,Effective,The med. controlled my seizure disorder.
tekturna,Effective,"Very well managed blood pressure within normal, healthy range.  I had an allergic reaction to a more common blood pressure medication, Lisinopril (which is a combination of a thiazide diuretic and an ACE inhibitor).  The newer Tekturna has worked perfectly for me with only the slightest dizziness when I rose too quickly early on, but no side effects at all after the first few weeks."
renova,Effective,"smoother skin,less lines on the face and neck area,collagen in skin is firmer and supple"
zegerid,Not Effective,The drug reduced the frequency of acid reflux events and the associated pain
sular,Not Effective,"Lowered blood pressure.  This was the last prescribed medication for out of control high blood pressure.  Apparently, it takes all three of the medications
to work together. With all of them, my blood pressure is within normal guidelines (or very close), but without any one of them, there is an immediate rise"
crestor,Effective,"After 60 days on Crestor, 5 mg. per day, in combination with changes to my diet, my LDL (bad) cholesterol fell from 180 mg/dL (high risk) to 95 mg/dL (optimal), a drop of nearly half.  My triglyceride levels were reduced as well."
metformin,Effective,"At the recommendation of the Life Extension foundation, I was taking 1850 mg per day of metformin prophilatically -- as an anti-aging medicine. Gene assay testing by Biomol resveals that metformin surpresses the Sir1 gene, acting as a calorie reduction memetic. Calorie Reduction is the only currently proven way to extend life span, and the hope is that metformin will mimic this. Resveratro ( herb ) also reputably does this."
lexapro,Not Effective,"Before I started on the drug Lexapro, I felt lethargic and didn't want to get out of bed each morning. I hated getting up and facing the day. I would sit and watch the time pass by. Finally, I went to my Dr. for a checkup and he diagnosed me as being depressed. He put me on Wellbutrin and Lexapro 10 mg. I was instructed to take the pill 2 times per day everyday. For the first week I felt disconnected from myself but by the 2nd week I started to feel as if each morning was something to look forward to. I believe that Lexapro was a great addition to my life during my troubled times."
naproxen,Not Effective,helped aleviate whip lash symptoms
synthroid,Effective,"i have mild hypothyroidism, so i wasn't necessarily aware of what having an underfunctioning was doing to my body.  still, i was able to detect changes (for the better) after taking synthroid for a few months.  the primary benefit i aw was HIGHLY HIGHLY improved concentration, which has made school/work such a pleasure.  i think my metabloism also improved slightly."
minocycline,Effective,face cleared up conciderably. It took about 2 months for the drug to become conciderably effective though.
zantac,Effective,"Reduce a lot the heartburn feeling, and after a week treatment no more heartburn where visible. Every other meal i was taken produced a lot of acid juices in my stomach, after that treatment this never happen."
prevacid,Effective,"Feels like it stops nearly all acid production, heartburn is gone.  Due to cardia weakness stomach contents can still travel up esophagus but no burning sensation is felt.  Regardless there is still some mild irritation in my esophagus."
tirosint,Not Effective,cold not discern because there was no clinical symptom other than tsh leel was low.the lab test result indicate improvement in tsh level but the doctor did not increase the dosage of the drug.
imitrex,Effective,"I was able to completely stop a migraine from happening once I felt one starting.  This has been extremely beneficial to me.  I have gotten my life back.  I would have 1-2 migraines a week which would put me in bed for 2 days.  I would take pain killers, which only knocked me out, doing nothing to alleviate the pain.  I was missing a large part of my life, being in bed.  Also I never knew when I would have to cancel plans or stay home from work due to a migraine.  I felt very unreliable, which is not me.  I am a very responsible person."
prempro,Effective,"Migraine problem: I now only have rare occurance of migraines, less than once a year.  Before Prepro treatment I had a migraines almost continuously, and took Frova at least twice a week. Potential benefits is prevention or delay of osteoporosis, since my mother had severe osteoporsis."
lexapro,Not Effective,"I sought treatment for two problems in my life: my temper with my daughter and my lack of motivation.  This drug really helped me to control my temper.  In fact, the temper became nonexistent.  I used to yell a lot and stopped completely within two weeks of being on this medication.  However, this was the only benefit I experienced."
zantac,Effective,"nearly instant pain relief , extremely efficace"
spironolactone,Not Effective,Hair loss. Helps hair follicles become less sensitive to protestosterone.
lipitor,Not Effective,My cholesterol was lowered by about 15 points. I did not seem to do anything else nor was it supposed to.
omnicef,Effective,The treatment cured the sore throat for which it was perscribed.
tazorac,Not Effective,"the treatment benefits for the cream Tazorac were improved skin tone, appearance of reduced wrinkles on forehead, undereye area, upper lip and nose. The skin felt softer and pimples were not prominent."
alendronate,Effective,Increased bone density by 11% first year.
vyvanse,Effective,Very good euphoria. More focused in school. Had a very very good feeling in torso area. I forget to eat sometimes and afterwards stomache hurts very  very bad. You do not realize that your hungry.
femring,Effective,"Do not experience hot flashes, night sweats, mood swings or insomnia due to menopause when using the Femring."
neurontin,Not Effective,"Well I just wanted to comment or get some incite on this medication. I was just proscribed this medication yesterday took first one before bed as doctor said and woke up this morning feeling like i had drank a case of beer i stumbled getting up out of bed then i felt like i was dying of thirst was just wondering how normal this was? Oh and i was very sleepy and unable to wake up till nearly noon i started to sober up. I have a 3yr old son that i stay home with so i need to be able to function. when i had spoke to my doctor about the problems i was having i told him that i did not want to be on anything strong i had previously been put on Vicodin, oxy-codone and flexeral i hated it i could not take care of my son i could not function im just trying to find a solution for my pain without being messed up.! See back in October of 2009 i fell backwards into a dresser corner while putting my sons clothes up in welkin closet had two possible fractures and two slipped disks was in a neck brace from oct-feb so please let me know if you have any idea what i can do my insurance will not cover physical therapy unfortunately ....."
soma,Effective,Minimized pain immediatley and made back injury seem non-existant
lipitor,Not Effective,"My overall cholesterol reduced to just over 4, but not LDL which still remained high within that total. This in my opinion is due to my thyroid condition."
tylenol,Not Effective,Little if any relief from headache.
ultram,Not Effective,"I found for me it was great for pain relief. Also, unlike some of the anti-inflammatory drugs I had taken in the past, I was not drowsy or sluggish during the day and I felt as if I could function normally."
ultram-er,Not Effective,"I was not able to ascertain any benefits from being treated with this medication.  Its purpose was pain relief, and I did not experience any alleviation of my pain."
viagra,Not Effective,Viagra did help me in acheiving an erection after prostrate surgery. Other methods that were offered were not as attractive at the 3 times daily dosage of Viagra.
seasonale,Effective,"While taking this method of birth control, my period only came once every three months. It was much lighter than before and only lasted 3 days instead of 6, which was normal before. I didn't experience any bloating. It's a very cost-effective method compared to three-month supply of normal 28 day cycle pills."
wellbutrin-sr,Not Effective,"decreased appetite, help to stop abusing alcohol"
lipitor,Not Effective,I didn't take the product long enough to evaluate the benefits. I quit because of side effects.
ambien-cr,Effective,The benefits from the ambien CR were phenominal when trying to fall asleep. It worked very well.
accutane,Effective,Finally clear skin and less oil!  Prior to accutane I HAD to wash my hair daily it was so oily  but now I easily an go a day or two.   My face and back were perfectly clear.
nasonex,Effective,"Able to breath at night, less sneezing. I woke up with less nasal stufiness and felt clear headed. I also appreciated the moisturizing glycerin in Nasonex. I have a extremely dry nasal mucosa so there was definitely a benefit to that."
fortaz,Effective,"got rid of the uti, however, it took longer than d-mannose a non-prescription otc natural sugar which also had no side-effects"
singulair,Not Effective,"There were no benefits, only bad side effects in that the drug significantly worsened my ability to breath."
xyrem,Effective,"While taking Xyrem, I slept exceptionally well at night, woke up rested, and strangely, within months of starting the medication, lost fifteen or more pounds."
provigil,Not Effective,"When I started first taking it it was great. I would get up in the am no brain fog, and could work the whole day not being tired. By night time though I was exhausted. After a month or so I still get up early but by afternoon I am so tired I usually try to take a nap or just keep going and eventually it will get better. I have not tried taking another in the afternoon. I have tried to up the dose in the am with no difference."
xanax,Effective,"The medicine keeps me calm under all circumstances, and helps me to sleep at night. I used to have panic attacks at times before I began using this medicine. Now the panic attacks are few and far between. Although I do not like to drive while taking the medicine, if I must I can with no problems. In social situations I am much more myself and can relax and have fun. I have had 3 mini-strokes. Since I began treatment with Xanax I have not had a single episode."
lexapro,Effective,"Before Lexapro I was so depressed I could not function. I forced myself to work, and would come home exhausted. I had suicidal ideation and severe anxiety. I had ""bouts"" of depression before, but was never treated. My separation and death of my Mother and loss of my job in one years time pushed me past what I could get myself out of. I was irritable, unsociable, had no desire to eat (lost 50 lbs that I could stand to lose in 6 months), cried all the time. I started Lexapro 3 months ago, almost 4. I began at 10 mg and it was upped to 20 mg. I feel like I am starting to have my life back. I laugh again (genuinely). I can get up for work, I can socialize. I still have days where I feel like crying and am very scared.. but it passes quickly. I have almost regained my general sense of optimism again. (I was always happy go lucky). I have NO ideation anymore.Lexapro is giving me my life back. It is like someone cleaned a really dirty window. I can see things more clearly now and do not ruminate as much as I did or have guilt feelings that are inappropriate. It saved my life."
zoloft,Not Effective,"Moderate lifting of depressive episode, made it so I could function better in everyday life."
differin,Effective,"The patient saw effective acne control within 4 weeks.  She still had occasional acne lesions but saw clearing of most of the comedones.  Because there were few new acne lesions, the hyperpigmentation she got along with the acne was not happening, and the hydroquinone helped to clear the hyperpigmentation she already had.  At four weeks, her skin tone was even."
zyban,Effective,"I stopped smoking after one week of starting the treatment. I never picked up another cigarette. The cravings for the sensation of smoking, as well as the craving for nicotine were short and sharp, and lessened within a short period of time. I was able to sit with another smoker and not smoke ( or want to smoke) within one and a half weeks of stopping. Incidently I lost 4 - 5 Kgs within 4 weeks of taking the drug."
anafranil,Effective,"Over time, this drug caused a massive reduction in my OCD hand washing rituals. I also no longer had to avoid public places for fear of germs.  Furthermore, clomipramine caused an immediate decrease in day to day anxiety and worry."
nuvaring,Effective,"THE NUVARING HAS PROVEN TO BE VERY EFFECTIVE FOR ME. I HAVE HAD A LOT OF PROBLEMS WITH BIRTH CONTROL THROUGHOUT MY LIFE. HAVING TRIED MANY IF NOT ALL POSSIBLE  BIRTH CONTROL TREATMENTS, I BELIEVE THIS IS THE ONE THAT WORKS THE BEST FOR ME. IT IS PRACTICAL AND VERY FEW SIDE EFFECTS WHEN COMPARED TO THE ORAL CONTRACEPTIVES, IUDs OR  INJECTIONS."
serzone,Effective,"Had generalized anxiety daily prior to treatment, and panic attacks that impaired ability to function normally and quality of life in general. Medication did not completely eliminate feelings of anxiety, but did a great job of reducing them. Taking the medication Serzone, made it possible to rely on the medication xanax less and less, to the point only had to take it seldom as needed."
propecia,Not Effective,preventing further hair loss
protonix,Effective,Effectively controlled acid reflux.  Before treatment patient had severe acid reflux which was not controlled by other medications.  After trying many other drugs the patient was prescribed protonix and it worked very effectively.  The patient was then able to eat regular meals with no ill effects.
mirapex,Effective,"First treatment in 50 years that helped the constant but elusive pain in my nervous system, causing me to sleep an hour or two at a time at best.  The pain is 100% gone when I take the mirapex ... back when I do not."
dexamethasone,Not Effective,"marginal, not sure if recovrey was from the drug or from the infection running it's course."
renova,Not Effective,Wrinles seemed less defined
toradol,Not Effective,None. She did an anaphylaxis schock and she did not receive any benefit .
diazepam,Effective,"The drug calmed me down and stopped me from crying constantly.I only took it when absolutely necessary which was a huge benefit, unlike the anti anxiety drugs given out now which you have to take every day for long periods.Valium works instantly and I never had any problems at all with it. I do not understand why it is not given out instead of all these other antidepressants which are readily available and cause huge problems and come with awful side effects."
accutane,Effective,My skin cleared up and my pores shrank significantly. My skin looked flawless. My pores have remained smaller long-term (5+ years post treatment).
zoloft,Effective,relaxed
actiq,Effective,"Without question, Actiq is an extremely effective drug if you are in chronic severe pain and have no responsibilities.  Actiq relaxes the body and the brain becomes numb and able to handle ongoing pain effectively.  It is fast acting in the subcutaneous, ""lollipop"" form and within minutes you are comfortable.
The flavor is also quite pleasant."
doxycycline,Not Effective,Treatment cleared up the infection.
meridia,Effective,I have been taking meridia for the last 6 weeks and have lost 16 lbs.  It has decreased my appetite and I am not thinking about food all the time.  Combined with diet and exercise this has helped me out a lot.
mobic,Not Effective,No impact whatsoever.  It was like I wasn't even taking anything.  The OTC ibuprofen I was taking before my doctor appointment was more effective.
provigil,Effective,"As a medical professional (newly graduated medical student now in first year of residency), I am able to feel more alert and focused during the day even after having been up all night.  As free time is scarce in residency, I am now able to study when I would otherwise be too exhausted to do anything."
