urlDrugName,highly_effective,benefitsReview
valium,Effective,"After intolerable side effects of an anti depressant it relaxed my stomach (stopped vomiting) relaxed muscles so constant shaking and shivering subsided,helped me sleep and for me to actually have normal and relaxed thoughts.

Taken when needed from normal anxiety it just relaxes body and mind... it's long lasting nature often means that"
ambien-cr,Effective,more restful sleep. which helped me to be more alert during the day and less nervous and paniky thinking about my inability to sleep at night knowing I had to work the next day.
abilify,Effective,"I had severe depression with agitation and mixed-state bipolar hypomania. I was insomniac. I took abilify 5mg for 3 mos, and then I upped it to 10mg."
naproxen,Not Effective,"releved pain for 1 hour but then has no more effect and caused pain not reileif possibly ebcause of `the fast i had high blood pr1essure but did not read it has high sodium, (low sodium diet for over 3 years)"
vicodin,Effective,"Acute pain in tooth subsided normally within 30 minutes, and the relief lasted 6-8 hours.  Allowed me to sleep the entire night without being awakened by the return of pain.

I was later prescribed Codeine after the procedure, which only dulled the pain to half intensity."
propecia,Effective,"It effectively slowed my hair loss dramatically. My barber of 15 years says my hair has not changed. I notice slight loss over the years, but I still have a lot of hair whereas I would most certainly be bald without it!"
zoloft,Effective,Completely eliminated anxiety disorder characterized by panic attacks and generalized anxiety after dosage of 50 mg/day was taken.  Downsside was that while on 25 mg/day start up dose for the first  7 days anxiety was extremely worsened and almost unbearable.
fosamax,Not Effective,there were none that I know. Still has osteroposis.  Had to stop because of the stomacjh effect.
alprazolam,Effective,"Anxiety greatly diminished shortly after taking alprazolam.  The alprazolam was also effective in calming the mind prior to sleep.  I have taken alprazolam for anxiety attacks, worrisome and obsessive thinking and in order to fall asleep."
levitra,Effective,The stuff works like a charm--fast and effective.
morphine,Not Effective,none
zithromax,Effective,"It is extremely, powerful antibiotic, which give immediate effect with in two hours."
flexeril,Not Effective,Not sure if it is effective or not.  Pain is gone in the morning but steadily increases as the day progresses.  I am virtually unable to function by evening.  I think I may ask my physician to prescribe an additional 5mg to be taken in the afternoon to see if that prevents the pain rebound in the afternoon.
lidocaine,Effective,"Almost immediate (i.e. within 15 minutes) relieve of severe nerve and/or muscle pain in neck, shoulder &/or lower back. These patches work like a miracle for me, although others who have used them say they offered no relief for muscle or nerve or shingles pain.  I have bone spurs in my neck which sometimes irritate the nerves in my neck and cause excrutiating pain ... also periodic sciatica and shoulder and upper & lower pack pain from an auto accident.  Chiropractic and message helps, but these patches are used when those interventions fail to bring about sufficient relief ... especially for the nerve pain in my neck. I use them only as a last resort."
prednisone,Effective,I went from being in extreme pain and sometimes almost immobile to being able to go back to work at a physical job
depo-provera,Effective,"I was taking this drug as birth control, and it has been extremely effective.  (No children, yet!) The fact that you only need to take it four times a year is great, so it is difficult to miss a dose. (Unlike the pill, which you take everyday, and missing it even once alters it's effectiveness.)  As an added bonus, I no longer have my period, which were extremely painful and disrupted my life for a whole week every month.  I no longer suffer from PMS symptoms, either.  I can not complain about this drug at all."
triaz,Effective,My acne has been greatly reduced and my skin is a lot clearer. I also found that my skin is less oily. I saw these results within the first month of using the product.
zyrtec,Effective,"I have good relief of sneezing, dripping nose, chesty cough, dry throat until a couple of months ago"
fluvoxamine,Effective,"within 2 weeks obsessional thoughts were less, so much so that she could return to work, she increased dosage slowly over a few months to maximum 150mgs with marked improvement in her obsessional thinking and she was able to complete a masters degree. After one year slowly decreased dose. Would definately take it again if obsessional thinking returns in the future"
haldol,Effective,"Was able to gain control after receiving the injection form of the medication.Was helpful in decreasing aggitation,psychosis,delusions.At the end of the required time in seclusion and after giving medication time to take effect patient was able to return to facility population without any further problems.Was able to maintain in a calm manner,much less aggitated and was able to meet to staff to discuss delional ideas."
propecia,Not Effective,There were no benefits that I could perceive.  The hairloss continued but worst of all the side-effects from this drug are severe and permanent.  This is very disturbing!
prednisone,Effective,I never really had any complications with my disease. It seemed to help treat the ulcers in my colon. It also let me be able to eat normal foods because when a person has Ulcerative Colitis they have to monitor what they eat and usually have to eat bland foods. It really helped me a lot but the side effects took away from the overall rating. The side effects most likely worsened because I was on the drug for a long period of time.
effexor,Not Effective,"less anxiety, emotional stability"
oxycontin,Effective,"when the drug wears off pain starts to increase to an almost intolerable level after taking 1 dose the pain is swept away and left feeling almost 100% better. BUT I must take 2nd dose in 12 hrs, to keep pain at bay."
singulair,Not Effective,"I'm told it opens airways, but also hear there are neg side effects. Witout it, I'm a bi more weazy, but not much."
temovate,Not Effective,"The resulting small, fluid-filled blisters (vesicles) most commonly occur on the palms and fingers of your hands and on the soles and toes of your feet. The blisters usually last for three to four weeks.

The blisters often cause intense itching. Scratching the blisters can damage the skin and, in some cases, lead to infection. Once the blisters dry, they often leave cracks and painful grooves (fissures) in your skin.
Risk factors

Dyshidrosis occurs twice as often in women as in men. Other risk factors include:

    * Stress, because dyshidrosis appears to be more common during times of stress
    * Exposure to metal salts, such as chromium, cobalt and nickel ? usually through cement or mechanical work
    * Having seasonal allergies, such as hay fever
    * Frequently exposing your skin to water or other wet substances"
avage,Effective,"Avage contributed to maximum exfoliation to treat both hyperpigmentaion and minimization of lines, creases and wrinkles. It also helped to minimize pore size and added a more radiant look to my skin (it was very dull and drab)."
nortriptyline,Effective,ability to sleep though the night decreasing joint/muscle pain and cramps allowing for a more productive day
tussionex,Effective,Suppression of cough
zoloft,Not Effective,"better thought process - clear thinking
better sleep at night
less anxious"
detrol-la,Effective,Greatly improved the sense of urgency. I usually had to urinate every 20-30 minutes. Now I can go as long a 2-3 hours. I find I need to take it as soon as I get up for the best results.  If I wait I have a morning of running to the bathroom. I used to get up around 3-4 times a night and now get up only once.
premarin,Effective,"no further hot flushes and palpitations, no mild panic attacks ,much improved sleep pattern, skin tone improved, much more positve attitude and general wellbeing, lowered cholesterol, and loss of weight gained prior to HRT, and also feel that my joints and flexibility has been maintained as physically I really am in much better shape and stronger than non HRT taking friends, and I am not an exerciser but am very activeie. paint the house, walk the dog etc"
celebrex,Effective,"I feel like a new person. I've had an MRI and all sorts of other tests and no one can find anything wrong with my right hip. I believe I tore the hip flexor several years ago in a yoga class and it never healed properly. Sitting at a desk for work aggravates the pain, and I bike every day which isn't good for it either. Additionally from sitting every day, my upper back and shoulders are often in pain. Celebrex took ALL aches away, and took my hip pain from a constant worrying sharp pain, down to a very mild twinge. LOVE IT."
chantix,Effective,30 year smoker at 1.5 packs per day
solodyn,Not Effective,"Solodyn contains minocycline and is formulated to be taken once a day. This was very convenient and easy to remember. It can be taken with or without food. The Solodyn seemed to reduce the number of inflammatory lesions, and reduced irritation and itching was considerably."
neurontin,Not Effective,The course of treatment reduced the severity and the frequency of the neck pain and migraines by about 50%.
effexor-xr,Not Effective,Alleviated deep depression.
emsam,Effective,I have been on every SSRI made- trial after disappointing trial since I was 19. This is the first medication that has worked for any length of time. (Paxil worked for a short period of time but maxed out w/o further benefit even with augmentation).
aralen,Not Effective,"my fever was reduced but just for a while, as i threw up almost every 30 minutes after taking the medication and and until i emptied my stomach, the nausea was constant with every intake of the drug ."
flonase,Effective,"I have had a cough for 15 years I related to allergies, plus post nasal drip that kept me up at night coughing.  Had sinus infections every year and then twice a year, went to dr and would be on antibiotics for 10 days or so and get better.  Well I finally went to a specialist and all the previous years I thought I was better, I was not.  My sinus were so infected he said I had a chronic sinus infection which was probably 4 years old.  He treated me for months with antibiotics and still could not clear up infection.  Sent me to Ear, nose , throat dr. and he wanted to do surgery right away.  That was 2 months ago.  After using the Flonase in combination with singular I have not had any problems.  Post nasal drip gone!!! which is a huge blessing.  Wish I had this nasal spray 10 years ago."
nuvaring,Effective,Treatment benefits were pregnancy prevention and regulation of menstrual cycle.
flonase,Effective,"I have had 1-2 sinus infections anually, compared to one every 4-6 weeks prior.  I had sinus surgery, THE MOST PAINFUL EXPERIENCE IN MY LIFE, some 20 years ago. I cannot recall the last infection I have had since beginning this treatment."
zantac,Not Effective,"The Ranitidine can be taken at any, time throught out the day, with or without food, but should be taken with lots of water. can try 30 mag first then 60 mg etc.
It can be taken up to 4 times per day."
elavil,Effective,"Good for sleep and to ease a tension headache and restlessness. You should take it only at beadtime, don't take it before driving a car. For me there are no side effects because of low dose probably. Ideal to balance your mood and improve your life quality."
keflex,Effective,NONE
ativan,Not Effective,"Absolutely none. My original dr. prescribed me Xanax, which, for me, is a life-saver. New dr. wouldn't put me on it, so I got Klonopin instead,(1mg, 3x's/day). After Klonopin made me sleepy, I asked for the only other bz he was willing to prescribe,(Ativan),and w/in one week was going through massive w/drawals from the lack of potency of the drug. So, back on Klonopin and the problems went away like that. May as well have been a sugar pill. Needless to say, I found a dr. to prescribe Xanax, and have had no problems since."
erythromycin,Not Effective,I was able to get rid of an infection that had been bothering for awhile.
neurontin,Effective,Chronic pain from degenerated cervical vertebra. Bulging discs indenting the dural sac reaching the cord from C5/7 without cord compromise.osteophytes pinching nerve roots bilateral C6. C7/t1 and T 2 Anterolisthesis
accutane,Effective,"Oily skin & hair reduced, clear skin, long lasting results!"
ortho-tri-cyclen,Not Effective,I was given this birth control to help stabilize my hormones to aid in clearing up my acne.  I never saw a significant improvement in my acne.
ultracet,Not Effective,There were no benefits to this treatment.
vivelle-dot,Effective,"cessation of hot flashes, vaginal dryness.  The patch is clean and always delivers the same amount of medication, so it is very reliable"
seasonale,Effective,"No irregular cycles right now, very little cramping or other PMS symptoms."
biaxin,Effective,"Clearing of sinus infection and bronchitis.  Used a few times for same problem, sometimes after trial of azythromicin (which did nothing) or doxycycline which  also did very little."
crestor,Effective,The treatment benefits were that my cholestrol levels went from 9 to the 4-5 level.  This was demonstrated by regular blood test results.
flonase,Effective,"i have had eustachian tube pain in my neck for about 2 years most days, and almost everyday this last year.  this is the only thing that has ever worked to relieve the pain, and as a benefit it helped with some mild allergies.  LOVE IT"
prozac,Not Effective,depression was alleviated to a functional degree.I wasn't in lala land but was able to get out of bed and care for my children. I was never suicidal or violent
accutane,Effective,"I have suffered from acne for 10+ years, and let me tell you, Accutane is the only thing that's worked for me.  Improvement in skin in days... clear skin in a couple weeks.  I have tried almost every treatment out there, and no results have compared to those I got from using Accutane.  Take it from someone who's suffered a long time: try it and you won't be sorry.  Be wary of some of the possible side effects, though.  I didn't experience anything too drastic, but everyone's different."
neoprofen,Effective,"I had very stron earache, which made me unable to work. High-dose Aspirin did not help, nor did Paracetamol. However, Ibuprofen worked perfectly: my pain was letely compgone as long as the tablet taken twas effective. Only about half an hour before I was allowed to take the next tablet did my earache start again. I was very happy!!"
lexapro,Not Effective,"Initially, Lexapro helped alleviate some of the stress I was experiencing. I noticed that situations that would normally aggravate me (i.e. stress of work, children, college assignments,etc.) I was able to handle better."
premarin,Effective,"I had a complete hysterectomy at age 52 and started HRT to avoid the immediate menapause which occurred right after surgery. Unfortunately the hospital staff put me on the estrogen patch which did not work and I was miserable the first couple of nights with severe hot flashes and poor sleep waking up often with soaked clothes and the sensation of itching everywhere during the day. Once my GYN doc changed me over to Premarin .625mg everything adverse disappeared and I enjoyed no menapausal hot flashes,mood swings, loss of sleep, vaginal dryness and my skin benefited as well, no lines or wrinkles and good elasticity."
zegerid,Effective,"It alleviated my Gastroesophageal Reflux Disease(Gerd)symptoms as long as I took the medicine as prescribed by the doctor,one capsule, once a day."
prednisone,Effective,I regained my hearing after a virus caused sudden sensorineural hearing loss in my left ear by taking Prednisone.
diovan,Not Effective,"After taking Altase, then Lisinopril, began Diovan, first 80 MG, then 160. The ""ACE"" cough disappeared with the 80 MG almost immediately. However morning surge BP continued."
minocycline,Not Effective,No change in acne despite 15 days of usage -- probably antibiotic resistant.
lamictal,Effective,"Completely took away my severe chronic body pain. I was able to sleep at night and was not fatigued during the day. You have to be very careful with the dosage and slowly increase it, but it is completely worth it."
ecotrin,Effective,the patient felt good. he was relieved of his symptoms. he felt les tired may be becuse of reassurance.the asirin tablets are known in india as blod thinner. the drug is gven to patiets even at a doubt of heart condition.the diazepal is a mild sedative without much sie effects this is proved a good drug for over anxious patients.
topamax,Effective,"Topamax greatly reduced severe migraines that were occurring almost daily and it  seemed to greatly lessen the hypersensitivity of my brain to overreact to triggers that caused my migraines(stress, changes in barometric pressure,certain food,smells,noise, and light),stabled moods,reduced irritability, increased weight loss(40lb)."
adipex-p,Effective,quick weightloss
adipex-p,Not Effective,quick weight loss
triamcinolone,Effective,"If used regularly, this treatment eliminates the white and rough spots my daughter gets all over her arms and hands (and in some cases, her legs)."
chantix,Effective,Quit smoking in 90 days
lamictal,Effective,Almost completely Stopped seizures
bystolic,Effective,"I have had SVT's all my life.  It was only when I turned 24 that I sought treatment for them as they usually were linked with a syncope episode.  I was originally put on the grandfather of beta/alpha blockers inderal.  While this drug was effective at treating my migraines, it was not particularly effective at controlling my palpitations and it tended to lower my blood pressure too much.  I always felt tired and had little energy on this drug.  At 24 years of age I was not happy to have the energy of a 65 year-old.  Next came atenolol and labatolol (when I was pregnant).  I also had break-through palpitations with these drugs as well as low-enegy side effects.  With labetolol I could barely jog down my street without becoming significantly winded and according to my cardiologist I fell into the 94th percentile for ""in-shape"" people my age.  Finally, when bystolic hit the market I was thrilled.  First of all I didn't need a large dose of it to be effective.  Second, it was effective.  I experience no break-through palpitations, and last but not least there were very few to no side effects.  I had energy again and I could get throught my cardiovascular exercise without becoming winded."
tetracycline,Not Effective,"some clearing of acne but not completely. re-occurrence still happened. Scarring was still there. Overall, did not feel that effectiveness was best. Possibly a more natural cure would have been better."
reglan,Not Effective,took the reglan to try to empty my stomach before i threw up and the reglan didnt work  -  the tagamet helped - scale 1-10 a 10
zantac,Not Effective,none
prilosec,Effective,"Stops acid reflux back into esophagus causes by eating, stooping, bending or even sitting in a position that pushes the stomach up, or just from eating even if standing.  Prevents burns to esophagus that can lead to esophageal cancer and ongoing pain."
lyrica,Effective,"Lyrica reduced the pain associated with my anklosing spondylytis when other therapies had failed.  I had tingling, numbness, pain, and very limited movement in my arms and legs from A.S. after developing 6 moderate sized bone spurs on my cervical spine.  It was severely limiting my ability to have any sort of life.  I have tried almost every form of pain killer from OTC to narcotics with very limited effects.  Lyrica works differently and I find that I can be RELATIVELY pain free.  It does not totally eliminate the pain but what it does is make it bearable so that I can function.  I could take more of it according to my doctor but I am more comfortable taking the lowest possible dose.  I've noticed that I have no more tingling, very little numbness, and a greatly expanded range of motion without pain.  I highly recommend this drug!"
ritalin,Effective,No longer fell asleep at inappropriate and dangerous times. For the first time in my adult life I was able to concentrate. I was able to effectively work and study.
accutane,Effective,Completely cleared up my acne b/4 my wedding.
ambien-cr,Not Effective,"I did eventually fall asleep but it took a while (was told it only takes 20-30 min. but ended up being a couple hours, I read and eventually fall asleep and then the quality of sleep was poor; I just toss and turn all night I have 23 left I'll keep taking till gone, maybe they will improve over time."
lupron,Effective,"The drug stopped my menstrual periods and put me into artificial menopause.  The hope was that it would trigger my body to go into menpause and stop the heavy bleeding associated with my fibroids.  Unfortunately, my period came back approximately 2 months after the last injection"
methadone,Effective,"I have been able to maintain sobriety and get my life back on track.  Methadone has allowed me to get my ""bearings"" underneath me, and really focus on what is important in life once again. After about 6 months, I began working and have been promoted consistently since then.  I am currently tapering and am really trying to be smart about it.  While I am very eager to be off methadone, I also do not want to rush it.  I feel that methadone should be one of the last options a person looks to when trying to stop opiate use because it isn't something that can be stopped whenever a person feels ready.  I have found it to be quite a complex task."
lodine,Not Effective,mild pain reduction in arm/wrist
nortriptyline,Effective,"I had migraines everyday, this slowly worked it up to where i'd only get a mild migraine once maybe twice a week at most."
paxil,Not Effective,"make me worry less, and did make me feel better about life in general. it made my mood switch from being completely depressed and miserable to happy."
tramadol,Effective,"The benefits allowed me to physically calm.  this allowed me to sleep better, eat less and encourage a better outlook. Without Tramal life was very down."
allegra-d,Effective,allergies were completely cleared up while on the medication.
parlodel,Not Effective,"IT decreased mildly elevated Prolactin immediately from 25 units to 10 units. (mg/l ?)
It also increased my sex drive, but this stopped after a while. 

It also moderately decreased Psoriatic Arthritis pains and also symptoms in nails and joints, but needed to be taken very regular for this.. Forgetting to take it twice a week already made it work less effective.

(Cabergoline was more effective, had less side effects- but potentially has side effects on heart valve, so one needs to be very careful with it. )"
prempro,Not Effective,"Diminished hot flushes, mood swings, anxiety, skin plumped out and wrinkles decreased, depression lessened, concentration and memory and focus improved."
lipitor,Not Effective,"It did lower my cholesterol slightly, but that may have also been du to a change in my diet."
ativan,Effective,it makes me not nervous and i think it helps with depression also
levothroid,Effective,"balancing of thyroid back to normal range. Prior to treatment, patient had some mental confusion, weight gain, needed extreme amounts of sleep.  With treatment, mental acuity was obtained, weight stablized, energy increased. At one time treatment was discontinued for one month by MD to ensure that the thyroid gland was not producing adequate amounts of thyroid. Patient was put back on treatment after blood tests confirmed levels in bloodstream.  This treatment has made a positive difference in patients life."
accutane,Effective,"Almost complete removal of all existing and future acne. I took this drug with meals and could not be happier. Accutane changed the whole composition of my skin, changing me from very oily to normal/dehydrated in just over two weeks. The remainder of the dosage resulted in secureing my clarity and allowing my skin to look and feel better."
wellbutrin,Effective,"Depression lifted, more energy, more focus, more productive at work and school, able to laugh and smile, still felt sad or upset sometime (which is good because it means I didn't feel numb like some anti-depressants make you feel, sleep better."
nexium,Not Effective,"reduced nausea from continual to episodic, feeling of fullness decreased"
clonazepam,Not Effective,"Prozac makes me feel just stabilized not really ""Happy"",it really just levels me out so i can cope with everyday life and the stresses involved. It was one of the better medications i have tried and have tried several over the past few years that really did nothing. Seroquel was also prescribed for sleeping . I took that in combination with the clonazepam"
estrace,Effective,"reduction of hot flashes, and reduction of vaginal dryness. I'd already been trying a vaginal estrogen ring, but this wasn't enough of a dose for me, apparently. Since taking out the ring, which I'd had in for 6 months, and using the cream instead, things have been a lot better (i.e. less dryness, and less pain with intercourse. Yay!"
metrogel,Not Effective,None.  This product as all prescription and nonprecriptions products that are available in the USA have offered no relief whatsoever from the flushing of Rosacea and extremely sensitive skin.
