urlDrugName,highly_effective,benefitsReview
albuterol,Effective,short term relief from breathing problems. especially beneficial when patient was experiencing other health issue like cold or flu
chantix,Effective,"enabled me to quit smoking, I think it works well, and even better combined with zyban/bupropion"
methadone,Effective,It worked but then I became addicted to methadone so basically it just traded one addiction for another. I don't take as many Methedone a day as I did pain pills because Methadone is long lasting so I guess it did help me.
prednisone,Effective,"60ml of Prednisone saved my cornea transplant.
Saved me from having to have another surgery on an already tramatized eye."
vyvanse,Effective,"Vyvanse has greatly improved my mood and the way I look at the day .I am able to concentrate and finish a job. I am also in a much better mood than when just on the antidepressant. I am less  prone to get angry ,irritated ,impatient and to ""fly of the handle"".I take it after lunch and it keeps me going till at least 8 pm. I accomplish alot more in a day. And best of all feel good about myself.Vyvanse does not give you that dropped feeling when it is wearing off."
propecia,Not Effective,None
neurontin,Not Effective,"To tell the truth, I did not benefit very much from this medication, even though I was taking maximum doses, the pain remained almost the same with or without medication. Maybe some people are more responsive to these kind of treatment, unfortunately not in my case."
benicar,Not Effective,"lowers blood pressure and helps prevent strokes. Helps the patient to function without the tingling, headaches, and chest pain that comes from having blood pressure too high."
paxil,Not Effective,"Loss of depression, reprieve from PTSD symptoms"
lamotrigine,Effective,"I began taking this medication during a very unstable period in my life and when I had been rapid cycling and experiencing mixed states, and over a 2 yr period it greatly helped increase my self-worth and overall stability. It helped me to get control of my life and avoid the severe depressions I was prone to, as well as putting a cap on my manias. I still felt mild highs or maybe natural euphorias but they are not manic-y and crazy. I even started being able to get sleepy at a normal hour and wake up in the morning. While on the medication I feel much clearer in general in my thoughts, so if I still feel down or up I am more confident in my ability to manage it. I feel like I am not overly leveled out and blah like I felt with Depakote, more like I avoid the worst and can be in control."
retin-a,Effective,"Regular use of Retin A cleared my acne dramatically. Initially, I experienced and increase in the presence of acne pimples and moderate redness and irritation. This lasted for a couple of weeks as my skin adjusted to the medication. Within about six weeks, I would guess my skin was 75% clearer. Over the past twelve years, I have experienced only rare pimples which resolved quickly with little or no discoloration. One important note: do not scrub the face with washcloths or any other abrasive products, and use plenty of moisturizer. Scrubbing makes the irritation and pimples worse."
nexium,Effective,Total recouperation from a long battle with acid reflux and stomach pains.
effexor-xr,Effective,"Alleviated my despair, gave me back some control of my emotions and motivated me to work harder at managing my depression and get out of the house."
prevacid,Not Effective,This was recommended to me instead of Gaviscon.  Supposedly it was a better solution for my indigestion.  Instead it was a disaster.
retin-a,Not Effective,"After weeks of use, I did see a considerable decrease in pimples on my face.  Being in my 40's, I saw a benefit in my skin tone also."
pristiq,Effective,"My headaches were less frequent, less severe, my PMDD symptoms decreased drastically."
duac,Not Effective,"I could not observe any benefits: my blackheads remained as they were, and acne remained. Probably my problem was not severe enough to see the results, however, due to no observed change I stopped using it."
diclofenac,Effective,The pain was greatly diminished and I was able to live my life in relative comfort.
valtrex,Effective,"I used to have at least 3 herpes outbreaks in the course of a year. These would interfere with personal time with my spouse, backpacking trips, day to day comfort.  In the time I have taken Valtrex I have not had one outbreak, and don't have to think about it any longer."
klonopin,Not Effective,"I felt relaxed, could sleep, good drug to be lazy on. If I felt panicky and wanted to relax I could. I don't have alot of benefits to say because I think the grouchiness outweighs the good side effects to me!"
concerta,Effective,patient took this drug to help with concentration and focus problems occurring in a classroom environment with many distractions.
estratest,Effective,Completely stopped hot flashes and night sweats. (I think there was also some mild improvement in skin thickness as well but it certainly did not end cellulite!)
vicodin,Effective,"It took the ""edge"" off the pain, for sure.  Without the medication I don't know how I could have put up with it."
keppra,Effective,The benefits of taking all these asthma medications is that I have been pretty much symptom free.  The Flovent has been particularly helpful in preventing flareups of my symptoms which has greatly reduced the need for my Albuterol.  The benefits of taking the Keppra is that I have only had one seizure episode since I began treatment in 2006.  The episode lasted only seconds.
lipitor,Effective,"Noticeably lowered blood pressure and stress level when taken.  If the patient missed a dose, he became more easily agitated.  When the Lipitor was administered, agitation would subside within 1/2 an hour.  The patient has a family history of hypertension, heart disease and sleep apnea.  Therefore, controlling hypertension is a major concern for this patient and may actually save his life."
minoxidil,Effective,Regained hair growth. Minoxidil first increased hairloss (normal during the first weeks of using). New hair started to grow after around seven months. I have not regained my normal hairgrowth. The hairs itself have a slightly larger diameter and are bit more curled.
lamotrigine,Effective,"It started working immediately which was wonderful.  My energy level increased, I was more interested in going out rather than hiding in my house.  I've increased to 100mg 2x's a day.  I've lost approximately 25 pounds but I think that's because of an interaction from the Concerta & Lamotrigine."
motrin,Effective,"loss of stiffness and more mobility.  After a heavy weight workout, taking Miotrin relieved the stiffness and iflamation around lower back.  Next day mobility and flesibility was much greater, and less pain."
renova,Not Effective,"The treatment benefits for Renova are more skin clarity.  Also, i believe the freckles on ;my face are fading quite a bit.  The fine lines did not really get any better. My skin is not really that different to notice real changes"
armour-thyroid,Effective,"Stopped hair loss, restored skin tone, normalized body fat/lean ratio, restored energy, restored normal sleep pattern and quality (had been waking feeling groggy, never felt rested)"
paxil,Effective,I have had excellent results with the drug.  I no longer have a negative or indifferent attitude towards life.  I am generally content and am capable of enjoyment.  I am still capable of feeling appropriate negative emotions but don't get stuck in them.
flonase,Effective,Reduced symptoms of seasonal allergies.
wellbutrin-xl,Effective,I dont have days that seem so dark that there is no hope for the future any more. If I am up set about something I can still function and not spend time hibernating and not functioning. I sleep regularly where before I had nights where I would not get any sleep at all. Activities are more enjoyable. I enjoy life more.
lamotrigine,Not Effective,"My mood swings lessened, only benefit"
spironolactone,Effective,"less hirsutism, reduction in acne, reduction in oily skin and oily hair"
norvasc,Effective,lower top/bottom reading numbers. I really don't understand the readings but initially they were like 140/90. now they read 120/70.
imitrex,Effective,"Imitrex has been a godsend.  After years of suffering pain and interruption of life due to migraines, just one little pill, either at the onset of pain or even when migraine is full-blown and pain is reliefed within 30 minutes."
biaxin,Effective,It effectively treated my maxillary sinus infection.  No more smelly nasal discharge and I could see the result within the first day of taking this drug.
xanax,Effective,Xanax is extremely effective and works very quickly.I have also noticed that some days I might not need it at all.I neither smoke nor drink alcohol so do not consider myself an addictive personality.Just need some extra coping skills for highly stressful emotional domestic situations
doxycycline,Effective,"My name is Nick Gikas- I considered myself a bit of a playboy until I caught a dose off a 54 year old pre-op tranny hooker-$250 NOT well spent. However, after seeing my local friendly doc and spending considerable time in hospital, this stuff cleared up Mr Tiny in no time. However, my arse is still in tatters and I've had to downscale from marrows to cucumbers in my spare time."
prinivil,Effective,blood pressure in check just have to visit the doctor once a year blood pressure now is 80/130
ambien,Effective,Fell asleep within 20 mins of taking the drug; sound sleep all night long; no hangover effect the next day.
nuvaring,Effective,"Required only one application per month, rather than having to take a pill everyday. Was also a lower dosage than the pill, which seems better. Because it is not ingested there was no nausea."
proquin-xr,Not Effective,"Reduces the symptoms of pseudomonas chest infection for a few weeks, especially the haemoptysis."
cozaar,Effective,Lower blood pressure
protonix,Effective,I felt immediate relief within 24 hrs - 2 tablets
omnicef,Effective,Cleared sinusitis very quickly. Ended a hacking cough after about a day as well.
adipex-p,Effective,"I lost 40lbs the first time I took it in only 2 months and kept it off for 1 year. I gained 20lbs back after that. I'm taking it again now and loose back down to my normal weight, stop taking it and gain all the weight back plus some. I've done this three times now even with an extensive workout routine and very healthy eating habits."
augmentin,Not Effective,"No benefits, did not help the initial problem of the sinus infection"
penlac,Not Effective,"none-I'm still taking it until the bottle runs out (like 3 more months) but I'm not optimistic. My dermatologist said toe nail fungus is really hard to treat. I have it on my big toe and it's not pretty. I tried homemade remedies first-white vinegar, hydrogen peroxide and Vicks vapo rub (which didn't work either but I swear better than both of the medications) The I tried Naftin gel for 3 months and now the paint-on Penlac generic."
premarin,Effective,"Premarin had a postiive effect on my moods, my skin was less dry and wrinkled and my weight gain distribution around my stomach decreased. In addition, my overall weight loss increased with proper diet and exercise. Prior to increased Premarin, this was not attainable."
propranolol,Effective,Stopped the body's reaction to anxiety attacks
aciphex,Effective,"stomach did not hurt any more. no more reflux in the middle of the night.I did not have to take it with any regard to food. the once a day dose mad it easy,did not have to take doses with me to work."
cymbalta,Effective,Worked very well to relieve depression and anxiety.  Left me feeling overall much calmer and more content.  Little things just wouldn't bother me anymore.  I stopped caring about things that used to upset me.
claritin,Effective,"After 4 to 5 days on the medication, Claritin greatly reduces itchiness, sneezing, scratchy throat associated with seasonal allergies"
avelox,Not Effective,none
doryx,Effective,"Been using retin-a for 9 yrs but had to start adding doryx due to resent cystic acne around my chin area, i noticed within a few days my skin has been glowing and my pores are much smaller. Its cleared up 80% of my acne and still seeing improvement"
doryx,Not Effective,Doryx taken to eliminate bateria that causes acne
fosamax,Not Effective,I was led to believe my bone density would improve with this drug and it would only need to be administered once a week.
ventolin-hfa,Effective,I have had asthma for years and take albuterol.  I heard about this new inhaler from a physician at work. He stated that it was a more pure form of the drug.  At the time he stated it was expensive to get. At the same time we were finding out that albuterol was being discontinued.  The replacement had a horrible taste to it. My son who has severe asthma was even refusing to take the new inhalor. I asked my physician for it specifically at my next visit. He did not hesitate to provide me the prescription.  My insurance company doesn't pay much of anything so I worried they would not cover it and they did.  I was very happy that it worked so well with no funny taste.
prilosec,Not Effective,It somewhat relieved my heartburn for a few days.
neurontin,Not Effective,To start with a numbness to the pain then my life was turned upside down.
nasacort,Effective,eliminates stuffiness.  best when applied after one dosage of over the counter (afrin ) or similar.
erythra-derm,Effective,Acne healed quickly with no other adverse reactions to the drug.
bisoprolol,Effective,Immediately controled palpitations associated with mild to moderate mitral valve regurtitation
tri-luma,Not Effective,it gave a little respons but once we stop applying the spots appear again so it is frustating to keep on applying.it is not a cure but just a satisfaction.
doryx,Not Effective,None!
accutane,Effective,When taking the Accutane I noticed a decrease in the amount of acne I had on my face over the course of the treatment.
lamictal,Effective,"The combination of Lamictal and Effexor eliminated severe mood swings betweens hypomania and depression, and made my depression manageable."
seasonique,Not Effective,"I was excited to have only 4 periods per year, but I never got that far, as I quit taking it after six days because of severe depression, crankiness, fatigue, uncontrollable hunger  water retention and weight gain."
differin,Not Effective,will see with time photo damage reduction.  Sun exposure ++ growing up in South Africa so fine lines and facial scar due to dog bite.  I have some medical training so am interested to see if any skin improvement
diazepam,Not Effective,"I found that I actually felt worse rather than better, the only benefit was that with  imovane I could sleep at night which I couldn't do earlier. I never really felt rested though. I am not sure if the combination of these 3 drugs caused my anxiety to become worse. Venlafaxine was supposed to help my depression but I found it totally ineffective. I am wondering if I get a higher dose will it help but I am afraid it might make it worse . WOuld love to go off all of these medicines as I feel the side effects are worse than the depression"
imitrex,Effective,"I had my first migraine at age 10 and suffered for almost 60 years. Then Imitrex--a miracle!  Imitrex, finally, gave me my life back. As I get older and am now retired (72) and have less stress, I use the stat dose once or never during the year. The 50mg tablet usually returns me to normal within an hour. A ""generic"" has become available but is less Imitrex and more Naprosin, an anti-inflammatory,  which is cheaper for the manufacturer but not good long-term for the patient. My doctor is keeping me on the brand name. However, Humana has dropped Imitrex coverage, not wanting to pay the high cost, which never gets lower as the manufacturer won't release the patent.  Now I'm worried, having to pay the entire cost myself, which is impossible.  It's a horrible dilemma.  I can't pay for it and they won't.  What now?"
nuvaring,Effective,"Did not get pregnant, regular periods."
retin-a,Not Effective,"Occasionally, acne would subside slightly."
asacol,Effective,I have found the product to be the only thing to work for autoimune Ulcerative Cholitis.    I was diagnosed with UC at age 43 after extensive testing.   Tried several other products and supplements to keep UC in remission but none have been effective.  The price is very expensive and is out of the reach of those without insurance cost is in the price range of $900 per months.   The company that makes the drug does offer programs for the non insured to receive at very substantial discounts or at no cost
effexor,Effective,"I noticed an improvement in my thinking within 3 days.  I began to think more positive and objective.  I also began to sleep much better, to much for quite a while.  After a couple weeks, I was not nearly as depressed and it kept getting better."
minocycline,Not Effective,The Sulfer drug helped reduce abdominal inflammation and reduced pain felt with Crohn's flare ups.
spironolactone,Effective,I am 28 and had acne like a 16 year old the day before the prom. It was horrible and embarrassing. This was an experiment. We had no idea if it would even work. We started at 50mg twice daily and then went to the 100mg when there were no results. My face is flawless now. I am also sleeping better which I don't think is a coincidence.
sarafem,Not Effective,"It kept me at a low-functioning level (work and occassional activities), which was an improvement for me.  It kept me functioning due to decreased depression.  I had taken it for a few years on and off before finally switching to another drug two days ago due to the drug becomming no longer effective.  When I was younger and the drug was new to me it was much more effective."
nuvigil,Effective,Benefits were I was able to stay awake during the day. And now that I have esophageal cancer I strongly believe Nuvigil is a big help with the side effects of chemoradiation treatments.
lamotrigine,Not Effective,"More mellow mood. Just taking Wellbutrin alone wasn't enough. I am a mild bipolar and needed something to balance out my moods. I have both depression and anxiety. And do not sleep well. That's why I was on Ambien, too."
lamictal,Not Effective,The drug was very effective at first at getting me out of depression.  However it lost effectiveness over time and the side effects became worse over time.
tramadol,Not Effective,Some reduction of pain
xanax,Effective,"I had severe anxiety attacks and once they would start it was very difficult to decrease their intensity.  My heart beat got as high as 160bpm on two occasions.  I found the .25mg Xanax pills to be very strong so I only would take 1/4 of a pill, which was enough to stop the attack or prevent one if I felt one coming on."
plavix,Effective,"Since starting the plavix and other meds, I have had no strokes."
augmentin,Not Effective,None/ had to many painful side effects.
ultram,Effective,Practically pain-free. Durins a flare-up I sometimes take a 50 mm pill in order to get more short term relief as opposed to the extended release pill.
naproxen,Not Effective,"The treatment did not affect the level of joint pain that I experienced, nor did it improve joint stiffness. I cannot comment on it's effect on inflammation as my inflammation tends not to be visible anyway. <i This may be the reason that Naproxen did not benefit me</i"
sulfasalazine,Effective,CLEARED UP ULCERATIVE COLITIS AND HAVE NOT HAD RELAPSE SINCE. I WAS DIAGNOSED WITH THIS ILLNESS WHEN I WAS 18. I LOATHED THE INVESTIGATIONS SO MUCH THAT I ONLY KEPT APPOINTMENTS TIL I WAS ABOUT 21. I STOPPED TAKING THE SALAZOPYRIN WHEN I WAS ABOUT 22. I HAD OCCASIONAL PROBLEMS BUT NOTHING THAT DIDN'T CLEAR ITSELF UP. I WENT ON TO HAVE 3 HEALTHY CHILDREN. HOWEVER IN 2001 THE PROB CAME BACK WITH A VENGEANCE AND I NEEDED SURGERY AND WAS VERY ILL - IT WOULD HAVE HELPED IF THE MEDICAL PROFESSION HAD TAKEN SOME INTEREST IN ME AND HADN'T SIMPLY TOLD MW I WAS TRESSED AND TO GO AWAY. PRIVATE CONSULTATIONS FINALLY MEANT THAT I WAS REFERRED TO A CONSULTATN AND HAD THE SURGERY
protonix,Not Effective,none
tamiflu,Effective,"My son came home from college with the flu. Student Health gave him a pack of Tamiflu and he felt better within 24 hours. When I started feeling sick 3 days later, I called my Dr and ask for Tamiflu. I felt almost back to norma lwithin 24 hours."
yasmin,Effective,easy prevention of pregnancy.
sarafem,Effective,"stabilized mood, allowed for clearer thinking, improved sleep pattern, felt less anxious, made world look bright again."
lexapro,Not Effective,"The treatment benefits were marginal at best.  Mood neither improved nor deteriorated, and anxiety was never significantly alleviated.  Unsurprisingly, recent research suggests that SSRIs are only effective in the most severe of cases."
ortho-tri-cyclen,Effective,"Prevented pregnancy, helped clear mild skin breakouts, keeps the menstrual cycle on a specific schedule, can alter cycle by having doctor let you know how to change your intake pattern for the pills."
accutane,Effective,immediately stopped getting acne.
propecia,Effective,The hair on the crown of the head significantly and visually filled in to the state it was 5 years earlier and has maintained this growth since.
flexeril,Effective,It greatly reduced the pain in the lower back and upper thigh muscles.It reduced the amount of spasms I was having in my lower back. I could not function as well if I did not take it.
tri-luma,Not Effective,"less acne, brown spots somewhat faded"
imitrex,Effective,"Imitrex was the miracle drug for me at first. Suffered with migraines since the age of 7 and never got relief except through ER shot of stadol/phenergen starting at age 27. So when doc gave me imitrex shot the first time I thought I found my miracle. 
It does get rid of the pain completely. I have no complaint about that.
I used to only get migraines once or twice a month."
botox,Effective,The furrows (lines above my eyes) on forehead disappered. They started reappearng after about three months. I looked younger. I also didnt look look like i was frowning all of the time.
zomig,Effective,allowed me to function rather than having to spend 2-3 days in bed
vyvanse,Effective,"Sustained focus, improvement in attention span and greater achievement of daily tasks.  Easy to take, just one pill a day!"
ambien,Not Effective,"there were no treatment benefits only bad side effects such as terrible nightmares, hyperventilating"
alprazolam,Effective,"Control of Panic Attacks that interrupted daily activity. Treatment of sudden increased anxiety, tachycardia, shortness of breathe, due to stress, general anxiety disorder."
vivelle-dot,Effective,"I began using Vivelle patches shortly after my hysterectomy five and one-half years ago. I have more stability in my moods w/ better emotional control. I have fewer episodes of irritability and feel more calm and collected. I don't experience any of the physical symptoms of menopause like, hot flashes."
climara,Effective,"Climara patch almost completely stopped the severe hot flashes and severe vaginal dryness. It also has improved skin tone and elasticity, moderated mood, improved sleep (by decreasing hot flash frequency). The side-effect of pain in liver area from estradiol by mouth has gone away using a dermal patch."
botox,Effective,General anti aging effects on the face. Decrease in current facial lines and wrinkles and prevention of formation of new lines and wrinkles.
evista,Not Effective,"It is supposed to lower the risk of breast cancer.  There was another abnormal mammogram & biopsy two years after starting it, but the biopsy was less abnormal. So no cancer is a benefit. There was NO improvement in bone density."
femhrt,Not Effective,reduced hot flashes; reduced heart palpitations
zoloft,Effective,in a very short amount of time all of my anxiety was gone which was worth the side effects. my depression decreased as well.
ultram,Effective,I've suffered with pain for 11 years now.  I was on Loritab for those 11 years.  I was getting 120 10mg filled every 15 days.  They would kind of knock the edge off my body pain but I had a constant headache.  My Dr. recently prescribed me Tramadol.
xanax,Effective,"Would bring down anxiety levels from an incapcitating point to a managable level on most occasions. Sometimes it could literally make the difference between being able to leave the house or not. Provided tremendous relief from the physical, mental and emotional symptoms of anxiety.

Worked very well as a sleep aid. Seldom experienced middle of the night waking."
claritin,Not Effective,Reduced asthma
zoloft,Not Effective,"I was having difficulty controlling my temper, having loss of motivation, anxiety.  This helped to take the edge off so that I could function without the extreme mood swings."
restoril,Not Effective,I need to take this medication a few nights in a row which seems to get my sleep cycle back in sync.  After a few nights of sound sleep I can fall asleep quickly without the need for medication.  My mind is able to stop its endless racing/
diflucan,Not Effective,"The yeast stopped coming out in chunks, but was more watery like... Still yeast tho so I wasn't pleased..."
neurontin,Effective,"Definite lowering of pain levels. Very gently, not like a pain pill. Several times I got off it, and about 48 hours later was in severe pain."
retin-a,Not Effective,I really did not experience any benefits.
zofran,Effective,cured the hyperemesis I was suffering completely with no noticeable side effects.
